{
  "schemaVersion": "fenrua.product-ontology.v1",
  "lastReviewed": "2026-07-14",
  "sourceReferences": {
    "companyIdentityId": "company-identity",
    "siteEvidenceId": "site-evidence-input",
    "documentRegisterId": "public-document-register"
  },
  "entities": [
    {
      "id": "fenrua.labs",
      "canonicalName": "Fenrua Labs",
      "entityType": "organisation",
      "status": "current",
      "category": "company",
      "definition": "Public display name for the company identified by the company identity record.",
      "aliases": ["FENRUA LABS PTY LTD"],
      "deprecatedAliases": [],
      "prohibitedAmbiguities": ["Do not use Fenrua Labs as the name of the public platform or a claim that every research artifact is a company service."],
      "replacementId": null,
      "effectiveDate": "2026-07-13",
      "publicRoutes": ["/", "/legal"],
      "owner": "public-platform",
      "evidenceIds": ["company-identity", "site-evidence-input"]
    },
    {
      "id": "fenrua.protocol",
      "canonicalName": "Fenrua Protocol",
      "entityType": "product",
      "status": "current",
      "category": "public-platform",
      "definition": "Current public platform label used by the Fenrua website and retired-route boundary.",
      "aliases": [],
      "deprecatedAliases": [],
      "prohibitedAmbiguities": ["Do not use Fenrua Protocol as the legal company name or as evidence that an unlisted product is available."],
      "replacementId": null,
      "effectiveDate": "2026-07-14",
      "publicRoutes": ["/"],
      "owner": "public-platform",
      "evidenceIds": ["site-evidence-input", "source-public-interface-doctrine"]
    },
    {
      "id": "fenrua.ai-efficiency-infrastructure",
      "canonicalName": "AI efficiency infrastructure",
      "entityType": "capability",
      "status": "current",
      "category": "technology-services-scope",
      "definition": "The public technical direction spanning research, software, infrastructure, and related technology services.",
      "aliases": [],
      "deprecatedAliases": [],
      "prohibitedAmbiguities": ["This direction is not a claim that every described primitive is production-ready or publicly available."],
      "replacementId": null,
      "effectiveDate": "2026-07-14",
      "publicRoutes": ["/", "/architecture", "/legal"],
      "owner": "public-platform",
      "evidenceIds": ["site-evidence-input", "source-public-interface-doctrine"]
    },
    {
      "id": "fenrua.layer-0-security-controls",
      "canonicalName": "Layer 0 security-control subsystem",
      "entityType": "subsystem",
      "status": "current",
      "category": "security-control",
      "definition": "A security-control subsystem within the broader AI efficiency infrastructure and related technology-services scope.",
      "aliases": ["Layer 0 AI security architecture"],
      "deprecatedAliases": [],
      "prohibitedAmbiguities": ["Layer 0 is not the complete definition of Fenrua Labs' business or future direction."],
      "replacementId": null,
      "effectiveDate": "2026-07-12",
      "publicRoutes": ["/architecture", "/kernel"],
      "owner": "security-architecture",
      "evidenceIds": ["source-layer0-architecture", "site-evidence-input"]
    },
    {
      "id": "fenrua.security-kernel",
      "canonicalName": "Fenrua Security Kernel",
      "entityType": "subsystem",
      "status": "current",
      "category": "security-control",
      "definition": "Public kernel model for identity, authority, integrity, policy, evidence, verification, containment, and recovery responsibilities.",
      "aliases": [],
      "deprecatedAliases": [],
      "prohibitedAmbiguities": ["The kernel does not certify production safety by itself or replace upper-layer applications and infrastructure."],
      "replacementId": null,
      "effectiveDate": "2026-07-12",
      "publicRoutes": ["/kernel", "/architecture"],
      "owner": "security-architecture",
      "evidenceIds": ["source-security-kernel-spec", "source-layer0-architecture"]
    },
    {
      "id": "fenrua.utilities",
      "canonicalName": "Utilities",
      "entityType": "capability",
      "status": "current",
      "category": "public-catalogue",
      "definition": "Public catalogue of maturity-labelled utility concepts and boundaries.",
      "aliases": [],
      "deprecatedAliases": [],
      "prohibitedAmbiguities": ["A utility catalogue does not make each listed utility a live hosted service."],
      "replacementId": null,
      "effectiveDate": "2026-07-12",
      "publicRoutes": ["/utilities"],
      "owner": "public-platform",
      "evidenceIds": ["source-layer0-architecture", "source-capability-maturity-register"]
    },
    {
      "id": "fenrua.evidence",
      "canonicalName": "Evidence",
      "entityType": "capability",
      "status": "current",
      "category": "public-evidence",
      "definition": "Point-in-time public records with stated source, revision, validation scope, maturity, and limitation.",
      "aliases": ["Evidence registry"],
      "deprecatedAliases": [],
      "prohibitedAmbiguities": ["A public evidence record is not universal certification, future evidence, or protected-system attestation."],
      "replacementId": null,
      "effectiveDate": "2026-07-13",
      "publicRoutes": ["/evidence", "/audit"],
      "owner": "public-platform",
      "evidenceIds": ["site-evidence-input", "source-public-interface-doctrine"]
    },
    {
      "id": "fenrua.verification",
      "canonicalName": "Verification",
      "entityType": "capability",
      "status": "current",
      "category": "verification",
      "definition": "Public verifier foundation, result specification, and local fixture-oriented checking boundary.",
      "aliases": [],
      "deprecatedAliases": [],
      "prohibitedAmbiguities": ["A verifier fixture or schema is not a hosted verifier or proof of production runtime conformity."],
      "replacementId": null,
      "effectiveDate": "2026-07-12",
      "publicRoutes": ["/verify", "/developers"],
      "owner": "developer-platform",
      "evidenceIds": ["source-verification-result-spec", "source-verifier-examples"]
    },
    {
      "id": "fenrua.research",
      "canonicalName": "Research",
      "entityType": "research-family",
      "status": "current",
      "category": "research",
      "definition": "Public research records in which claims, non-claims, evidence, maturity, and limitations are kept adjacent.",
      "aliases": ["Research Registry"],
      "deprecatedAliases": [],
      "prohibitedAmbiguities": ["A research result does not by itself establish a production capability or certification."],
      "replacementId": null,
      "effectiveDate": "2026-07-12",
      "publicRoutes": ["/research"],
      "owner": "research",
      "evidenceIds": ["source-research-governance", "source-public-interface-doctrine"]
    },
    {
      "id": "fenrua.pn521",
      "canonicalName": "P/N521",
      "entityType": "research-family",
      "status": "current",
      "category": "cryptography-research",
      "definition": "Research family represented publicly by the P/N521 cross-limb borrow regression record.",
      "aliases": ["P/N521 Cross-Limb Borrow Regression"],
      "deprecatedAliases": [],
      "prohibitedAmbiguities": ["The published regression record does not prove production certification or all arithmetic invariants."],
      "replacementId": null,
      "effectiveDate": "2026-07-12",
      "publicRoutes": ["/research/pn521-cross-limb-borrow"],
      "owner": "research",
      "evidenceIds": ["source-research-governance"]
    },
    {
      "id": "fenrua.fenc978",
      "canonicalName": "FENc978",
      "entityType": "observation-source",
      "status": "current",
      "category": "observation",
      "definition": "Public label for the bounded Chain 978 observation source.",
      "aliases": ["Chain 978"],
      "deprecatedAliases": [],
      "prohibitedAmbiguities": ["Chain 978 observation is not the definition of the platform and does not prove contract safety, bytecode identity, reserve state, or deployment correctness."],
      "replacementId": null,
      "effectiveDate": "2026-07-14",
      "publicRoutes": ["/status", "/research/read-only-chain-observation"],
      "owner": "operations",
      "evidenceIds": ["source-observation-gateway", "source-capability-maturity-register"]
    },
    {
      "id": "fenrua.fenn521",
      "canonicalName": "FENn521",
      "entityType": "observation-source",
      "status": "current",
      "category": "observation",
      "definition": "Public label for the bounded Chain N521 observation source, which remains subject to its independent evidence boundary.",
      "aliases": ["Chain N521"],
      "deprecatedAliases": [],
      "prohibitedAmbiguities": ["Chain N521 observation is not the definition of the platform and no liveness claim is made until its signed gateway and key are configured."],
      "replacementId": null,
      "effectiveDate": "2026-07-14",
      "publicRoutes": ["/status", "/research/read-only-chain-observation"],
      "owner": "operations",
      "evidenceIds": ["source-observation-gateway", "source-capability-maturity-register"]
    },
    {
      "id": "fenrua.local-trust-gate",
      "canonicalName": "Local Trust Gate",
      "entityType": "capability",
      "status": "planned",
      "category": "developer-integration",
      "definition": "Planned developer integration concept; this public model records no implemented interface, release, or evidence record for it.",
      "aliases": [],
      "deprecatedAliases": [],
      "prohibitedAmbiguities": ["Do not present Local Trust Gate as an available API, CLI, SDK, hosted service, or production control."],
      "replacementId": null,
      "effectiveDate": "2026-07-14",
      "publicRoutes": [],
      "owner": "developer-platform",
      "evidenceIds": []
    },
    {
      "id": "fenrua.public-evidence-interface",